depcom,id_ea,principal,numero,repetition,complement,type_voie,libelle,rivoli,categorie,type,nombre_logements,actualité,numero_permis,commentaire,annee_construction,nombre_immeubles,nombre_niveaux,sous_type,enseigne,lien_cmt,x,y,code_epsg,type_localisation,numero_parcelle,iris,ilot,qp,canton,liste_insee,id_rp,dernier_tirage,echantillon,grp_rotation,datemaj_ea,com_anc_idft,com_sous_categorie,com_statut,com_nb_log,com_nom,com_date_creation,com_date_fermeture,com_capacite,envoi_modif_importante,envoi_commentaire
93010,930100001122498,O,1,,,R,DESIRE LEON,2540,HABIT,21,1,2,PC9301023B0014,INSEE 03/08/2023: Une EA existe déjà à cette adresse. Le permis indique la construction d'une maison, et la démolition d'1 logement. ¶Faut-il périmer l'ancienne EA et conserver la nouvelle ? Faut-il modifier l'adresse de la nouvelle EA ? Merci de faire les modifications nécessaires.,0,,,,,1,662965.60000,6866124.50000,2154,BDA1,AQ0080,305,,,6,O,,,N,,,,,,,,,,,
93010,930100000631086,O,48,,,R,EDOUARD VAILLANT,3115,HABIT,23,15,3,PC9301016B0056,MAIRIE 24/10/2023: travaux en cours 1 an encore¶MAIRIE 03/03/2023: le petit château¶MAIRIE 10/11/2022: travaux en cours. 4 étages montés.¶MAIRIE 06/04/2022: travaux en cours. 1 étage.¶MAIRIE 09/03/2021: ancienne maison détruite¶MAIRIE 19/10/2020: travaux en cours¶DR 16/10/17.1ER FLUX DE PC .Une EA existe déjà, doit on périmer cette EA,si les deux existent quelle nouvelle numérotation,¶Merci d'effectuer les modifications,¶MAIRIE 05/06/2018: Actuellement, il n'y a qu'une seule maison à cette adresse, la même maison  depuis de nombreuses années (je l'ai recensé en 2004)  les travaux ne sont pas encore commencés et le PC n'est pas encore affiché. Je pense qu'ils démoliront l'ancienne maison pour reconstruire à la place un immeuble.¶MAIRIE 26/03/2019: L'ancienne maison est toujours là et aucun travaux n'est encore commencé. Le PC est affiché dans la rue du Vieux Château puisque cette adresse est à l'angle de rue E. Vaillant et de la rue du Vieux Château. La cour arrière donne rue du Vieux Château mais la BAL est rue Edouard Vaillant sous le n° 48 | sur le PC, il est indiqué qu'il y a 190 m2 (ancienne maison) à démolir mais ce n'est pas encore fait.,0,,,,,1,662021.90000,6866335.40000,2154,BDA1,AS0064,303,,,6,O,,,N,,,,,
93010,930100000003900,O,19,,,R,BORDIER,740,HABIT,22,2,3,,MAIRIE 24/10/2023: travaux : surélévation étage. 6 mois.¶MAIRIE 03/03/2023: travaux mais habitation¶INSEE 13/02/2023: Suite fiche navette RP 2023, cette EA est passée en actu 3.,0,2,1,,,1,662126.00000,6866553.30000,2154,BDA1,AL0110,304,,,6,O,93010   AL02 086,2023,N,5,,,,,,,,,,
93010,930100001063715,O,103,,103 - 113,R,EDOUARD VAILLANT,3115,HABIT,23,56,3,PC9301021B0060,MAIRIE 24/10/2023: travaux reste 1 an¶MAIRIE 03/03/2023: EA périmées 103 107 109 111 ¶MAIRIE 10/11/2022: en construction¶INSEE 06/09/2022: EAAC 1er flux 22-23 PC autorisé pour la construction de 56 logts et la destruction de 6 logts, manque référence cadastrale (Descriptif :  démolition complètes des maisons et construction d'un batiment unique de 56 logements)¶¶Périmer les EA qui vont être détruites quand inhabitables.¶Avant de rendre habitable merci de nous indiquer les adresses attribuées à cette résidence avec la répartition des 56 logts si plusieurs hall d'entrée.,0,,3,,,1,662339.08175,6866276.25975,2154,MAN,,304,,QN09312I,6,O,,,N,,,,,,,,,,,
93010,930100001016986,O,55,,55-57,AV,CARNOT,1430,HABIT,23,49,3,PC9301020B0036,MAIRIE 24/10/2023: 6 mois de travaux encore. 1 seule entrée. 2 halls. pas d'accès actuellement.¶INSEE 15/05/2023: Merci de nous indiquer la répartition des 49 logements par hall d'entrée.¶INSEE 15/05/2023: Suite à l'arrêté de numérotation n°A2023_051 du 27 février 2023, la numérotation est la suivante : ¶- Hall A et B : 55-57 avenue Carnot.¶¶MAIRIE 27/03/2023: plus qu'un mois !¶MAIRIE 01/12/2022: 5 étages montées. Fini dans un an¶MAIRIE 06/04/2022: ouverture chantier côté Blanqui.¶INSEE 11/02/2022: Suite PC 3ème flux 21-22 création de l'EA - A priori construction de 49 logts : 3 parcelles cadastrales concernées AC0036-AC0037-AC0007 - Que deviennent les habitations sur ces 3 EA ? vont-elles être détruites ? Merci de bien vouloir vérifiers ces 3 EA -,0,,,,,1,662006.14726,6866808.60981,2154,MAN,AC0039,402,,,6,O,,,N,,,,,,,,,,,
93010,930100000002850,O,79,,,R,LOUIS AUGUSTE BLANQUI,5170,HABIT,21,1,3,,MAIRIE 24/10/2023: idem¶MAIRIE 11/04/2023: idem¶MAIRIE 01/12/2022: Travaux abandonnés Café petit Blanqui¶INSEE 12/07/2022: Suite Expertise Légale : EA actu 3.¶MAIRIE 07/07/2022: idem¶MAIRIE 22/06/2021:  pas de PC affiché pas de travaux commencés semble abandonné¶INSEE 19/02/2020:  suite RP 2020 FN, actualité 3-travaux commencés,  motif : Adresse non habitée, en cours de construction ou de réhabilitation, merci de vérifier le type, l'actualité, d'indiquer le n°du PC et le nombre de logements.¶MAIRIE 18/06/2020: pas de pc affiché maison abandonnée à proximité du café ' le petit blanqui' qui est fermé lui aussi,1948,1,1,,,1,662277.30000,6866660.50000,2154,BDA1,AB0003,402,,,6,O,93010   AB03 047,2020,N,2,,,,,
93010,930100001082764,O,1,,,R,DE L'UNION,9550,HABIT,21,1,2,PC9301022B0050,MAIRIE 24/10/2023: idem¶MAIRIE 27/06/2023: PC affiché division de partielle travaux non commencés¶¶INSEE 26/06/2023: Merci de nous communiquer un numéro de permis lorsqu'il sera obtenu.¶INSEE 26/06/2023: Réception de l'arrêté de numérotation n°A2022_620 du 10/01/2023 : division de la parcelle cadastrée section AL0106, AL0152, AL0197, AL0105 en deux lots : ¶- Lot A : 28 rue Louis Léon Collignon (lot bâti) |¶- Lot B : 1 rue de l'Union (destiné à la construction).¶¶INSEE 17/05/2023: Nous n'avons pas d'arrêté de numérotation pour cette adresse. Merci de reprendre l'actualité de cette EA. ¶MAIRIE 18/01/2023: arrêté de numérotation envoyé gestionnaire,0,0,0,,,1,662234.73073,6866485.46980,2154,MAN,AL0197,304,,QN09312I,6,O,,,N,,,,,,,,,
93010,930100001063694,O,3,,,AV,DENISE,2520,HABIT,23,2,2,PC9301020B0080,MAIRIE 24/10/2023: verification terrain ok.¶INSEE 28/11/2022: Merci de vérifier l'adressage de cette EA et de l'EA déjà existante au 3 avenue Denise (accès secondaire 64 Edouard Vaillant).¶MAIRIE 10/11/2022: 1 BAL verif sur le permis¶INSEE 06/09/2022: EAAC 1er flux 22-23 PC autorisé pour 2 logts, pas d'information sur l'adresse ni sur la référence cadastrale.¶Avant de rendre habitable vérifier et modifier l'adresse, le positionnement et la référence cadastrale de ces 2 logts.,0,,,,,1,662145.12648,6866301.80379,2154,MAN,AS0128,303,,,6,O,,,N,,,,,,,,,,
93010,930100001122493,O,24,,,AV,DENISE,2520,HABIT,21,1,2,PC9301022B0067,INSEE 03/08/2023: Une EA existe déjà à cette adresse. Le permis indique la construction d'une maison individuelle, et 1 logement démoli. ¶Faut-il périmer l'ancienne EA et conserver la nouvelle ? Faut-il modifier l'adresse de la nouvelle EA ? Merci de faire les modifications nécessaires.,0,,,,,1,662094.70000,6866196.00000,2154,BDA1,AS0116,303,,,6,O,,,N,,,,,,,,,,,
93010,930100000002800,O,19,BIS,,R,CHARLES FERDINAND,1469,HABIT,21,1,3,,MAIRIE 24/10/2023: idem¶MAIRIE 11/04/2023: idem¶MAIRIE 01/12/2022: idem¶MAIRIE 30/03/2022: idem¶MAIRIE 05/11/2021: Idem¶Travaux arrêtés depuis longtemps d'après sa voisine d'à côté (qui est une collègue). Il semblerait que le propriétaire soit logé chez ses parents à Bondy rue du Progrès. Pas de PC affiché. Je n'ai vu moi-même aucune activité à cette adresse depuis longtemps.¶MAIRIE 26/03/2019: RAS rien n'a changé depuis l'année dernière, PC effacé, pas de travaux visibles en cours.¶MAIRIE 18/06/2020: maison abandonnée pas de travaux en cours,1948,1,1,,,1,662389.00000,6866764.00000,2154,BDA1,AB0039,402,,,6,O,93010   AB02 023,2013,N,5,,,,,,,,,
93010,930100000010562,O,27,BIS,,R,DES CINQ ORMES,1520,HABIT,21,1,3,PC9301096B0010,MAIRIE 25/10/2023: idem¶MAIRIE 03/03/2023: idem¶MAIRIE 02/12/2022: Oui les travaux sont abandonnés¶MAIRIE 30/03/2022: idem¶MAIRIE 05/11/2021: idem¶MAIRIE 09/03/2021:  travaux abandonnés¶MAIRIE 19/10/2020:  travaux abandonnés¶MAIRIE 30/05/2018: PC pas affiché - RAS depuis des années - Travaux semblent arrêtés.¶MAIRIE 26/03/2019: Travaux arrêtés depuis des années. Rien de plus de visible que l'année dernière.¶MAIRIE 18/06/2020: maison sur deux étages les travaux sont à l'abandon,2011,1,0,,,1,662819.50000,6866969.10000,2154,BDA2,V0121,405,,,6,O,,,N,,,,,,,,,,,,
93010,930100001085136,O,19,,,ALL,DE LA VILLA JEANNETTE,4750,HABIT,21,1,3,PC9301022B0057,MAIRIE 25/10/2023: travaux autorisés. rencontre du propriétaire qui travaille seul. fin prévue fin 2024.¶MAIRIE 11/04/2023: pas de travaux en cours¶INSEE 10/02/2023: Une EA existe déjà à cette adresse. Le permis indique la 'démolition de deux habitations et la construction d'une habitation'. Faut-il périmer l'ancienne EA et conserver la nouvelle ? Merci de faire les modifications nécessaires.,0,,,,,1,662627.70000,6866444.60000,2154,BDA1,AN0055,305,,,6,O,,,N,,,,,,,,,,,,
93010,930100000004361,O,5,,,ALL,RACINE,8110,HABIT,21,1,3,,MAIRIE 25/10/2023: travaux en cours.¶MAIRIE 11/04/2023: idem¶MAIRIE 02/12/2022: Idem¶MAIRIE 09/03/2021:  travaux semblent abandonnés¶DR le 7/3/17 : en construction pas de n° de PC suite retour collecte 2017. MAISON EN CONSTRUCTION RC + 1 ETAGE - IL Y A BIEN UNE PANCARTE MAIS LE PC ET TOUTES LES INFOS DE L'ADRESSE SONT EFFACES.¶MAIRIE 30/05/2018:  Rien de changé depuis la dernière fois sauf que les travaux semblent arrêtés !¶MAIRIE 09/04/2019: Pas de PC affiché, RAS les fenêtres ne sont toujours pas mises et les travaux semblent arrêtés.¶MAIRIE 18/06/2020: Travaux en cours 1 logement à venir,2000,1,1,,,1,662962.50000,6866390.60000,2154,BDA1,AO0132,305,,,6,O,93010   AO05 032,2017,N,4,,,,,,,,,,
93010,930100001098140,O,25,,,R,DU CYCLE,1590,HABIT,21,1,2,PC9301020B0042,INSEE 07/04/2023: Deux EA existent déjà à cette adresse (1 EA habitable et 1 EA en travaux commencés). Le permis indique 'construction nouvelle : pavillon neuf'.   Merci de vérifier le positionnement et l'actualité de l'entité adressée (parcelle cadastrale 0T0188 non trouvée en date d'aujourd'hui). Si l'EA habitable n'existe plus, merci de la périmer (terrain nu en satellite et sur Maps).,0,,,,,1,663067.00000,6867346.60000,2154,BDA1,0T0029,405,,,6,O,,,N,,,,,,,,,,,
93010,930100000273040,O,6,,,ALL,MARCEL SEMBAT,6130,HABIT,21,1,3,PC9301015B0065,MAIRIE 25/10/2023: idem¶MAIRIE 03/03/2023: idem¶MAIRIE 09/12/2022: idem¶MAIRIE 30/03/2022: idem¶MAIRIE 03/03/2021:  travaux abandonnés???¶MAIRIE 04/11/2020:  maison de deux étages en cours de construction ( murs en brique)  mais les travaux semblent abandonnés¶INSEE LE 12/12/16 : merci de vérifier l'actualité de ce pc. Il existe déjà un pc actu 2 sur cette EA.¶MAIRIE 25/03/2019: un petit bâtiment de 2 étages se construit entre la maison du n° 4 et celle du n° 6. La maison au n° 4 est habitée, les travaux du petit bâtiment sont stoppés d'après une voisine et la maison du n° 6 est couverte de bâches suite à des problèmes avec la nouvelle construction d'à côté. Aucun PC n'est affiché,0,,0,,,1,663082.10000,6866824.10000,2154,BDA1,X0054,401,,,6,O,,,N,,,,,,,,,,,
93010,930100001079783,O,40,,PC9301021B0105,ALL,THERESE,9130,HABIT,21,1,2,PC9301021B0105,MAIRIE 25/10/2023: pas de travaux d'après une riveraine.¶MAIRIE 11/04/2023: pas de travaux¶INSEE 08/12/2022: Une EA existe déjà à cette adresse. LE PC indique 'agrandissement de la maison existante pour la réalisation d'un second logement'. ¶Dans ce cas, une fois les travaux terminés, merci de modifier le nombre de logements et le type de l'EA existante. Sinon, merci de faire les modifications nécessaires à la situation constatée sur le terrain.,0,,,,,1,663287.20658,6867212.73315,2154,MAN,0T0132,405,,,6,O,,,N,,,,,,,,,
93010,930100001036584,O,8,,PC9301020B0057,R,BENOITE GROULT,665,HABIT,23,30,3,PC9301020B0057,MAIRIE 26/10/2023: encore 6 mois de travaux¶INSEE 26/04/2023: Îlot C9A : 8 rue Benoîte Groult = 30 logements.¶INSEE 29/04/2022: EAAC 4e flux 21-22 PC autorisé pour la construction de 30 logements (Description :    CONSTRUCTION D'UN ENSEMBLE MIXTE COMPRENANT 30 LOGEMENTS ET UN COMMERCE).¶Nous n'avons pas d'information sur la parcelle cadastrale ni l'adresse de ce PC, merci de vérifier et modifier l'EA en ajoutant la parcelle cadastrale, l'adresse et le positionnement.,0,,,,,1,661637.69479,6867584.87406,2154,MAN,0H0425,108,,,6,O,,,N,,,,,,,,,,
93010,930100001017816,O,1,,PC9301020B0056,R,BENOITE GROULT,665,HABIT,23,65,3,PC9301020B0056,MAIRIE 26/10/2023: 1 an de travaux à prévoir¶INSEE 25/04/2023: Permis remis en Travaux autorisés. Îlot C9 (angle des rues Benoîte Groult, Simone Veil et Nadia Murad).¶INSEE 17/04/2023: Pourquoi avez-vous périmé ce permis en novembre 2022 ? ¶A priori, il s'agit de l'îlot C9 (3 permis pour les 124 logts : PC9301020B0056 + PC9301020B0057 + PC9301020B0058). ¶INSEE 16/02/2022: Création suite PC 3ème flux21-22 - Voir svp si EA bien placée -,0,,,,,1,661703.89327,6867617.81962,2154,MAN,0H0386,108,,,6,O,,,N,,,,,,,,,,
93010,930100001099375,O,0,,PC9301020B0058 - BAT D,R,BENOITE GROULT,665,HABIT,23,29,2,PC9301020B0058,MAIRIE 26/10/2023: 1 an de travaux encore¶INSEE 25/04/2023: D'après le plan transmis par la mairie sur la numérotation des Rives de l'Ourcq, il s'agit du Bât D, angle des rues Benoite Groult et Simone Veil.¶INSEE 13/04/2023: Ce permis arrive sans voie ni parcelle cadastrale. Îlot concerné du programme de la ZAC Rives de l'Ourcq non identifiable au vu de la description du PC. Merci de compléter la parcelle cadastrale, l'adresse, et de repositionner l'EA en fonction des informations dont vous disposez en mairie. [descriptif des travaux : construction d'un ensemble mixte d'environ 165m² d'activité et de 29 logements collectifs'].,0,,,,,1,661702.82290,6867591.85489,2154,MAN,0H0425,108,,,6,O,,,N,,,,,,,,
93010,930100000997685,O,20,,20-33,CHE,LATERAL,5109,HABIT,23,123,3,PC9301020B0069,MAIRIE 26/10/2023: voir dans 1 mois¶MAIRIE 11/04/2023: en voie de finition pas d'accès¶INSEE 16/12/2022: Avant de rendre habitable, merci de bien vouloir nous communiquer l'adressage exact, ainsi que la répartition des logements au sein des bâtiments (dégroupement).¶MAIRIE 07/12/2022: 21-33 Rue chemin latéral travaux en cours emplacement du panneau¶MAIRIE 19/05/2022: l'adressage se fera sur Simone Veil¶MAIRIE 16/11/2021: pas d'adressage encore.¶INSEE 23/09/2021: Création EA suite PC 1ERFLUX 21-22,0,,,,,1,661671.89351,6867686.35492,2154,MAN,0H0404,108,,,6,O,,,N,,,,,,,,,,
93010,930100001137157,O,2,,BAT 500,R,GISELE HALIMI,4163,HABIT,23,15,4,PC9301018B0025,MAIRIE 26/10/2023: 5 rue nadia murad = bat 300 400 = 46¶7 rue nadia murad = bat 200 = 26¶7 rue simone veil = bat 100 = 25¶5 rue simone veil = bat 600 = 26 ¶2 rue gisèle halimi = bat 500 = 15        ¶INSEE 06/10/2023: Adresse dont il faut revoir le dégroupement (nombre de logements par adresse + adressage complet des bâtiments).¶Pour rappel, vous indiquiez 'MAIRIE 17/07/2023: dégroupement 7 rue nadia murad, bat 100 (12 BAL) et bat 200 (au 7 toujours) (14 BAL) - bat 300 et 400 (46 BAL) au 2 gisèle Halimi, bat 500 (15 BAL) au 2 g. halimi également, au 5 simone veil bat 600 (26 bal).' ¶¶INSEE 26/04/2023: Îlot C8 : ¶1-3-5-7 rue Simone Veil + 5-7 rue Nadia Murad + 2-4 rue Gisèle Halimi + 1-3 quai Hubertine Auclert. ¶Merci de nous communiquer le dégroupement lorsqu'il sera connu (adresse + bâtiment + nombre de logements).¶MAIRIE 11/04/2023: à revoir dans 6 mois¶MAIRIE 09/12/2022: Idem¶MAIRIE 19/05/2022: idem¶INSEE 23/09/2021: LOT C08 ZAC DES RIVES DE L'OURCQ¶MAIRIE 03/03/2021:  Immeubles en cours de construction¶INSEE 05/09/2019: Création EA suite 1er flux de pc je l'ai plaçe a la ref cadastrale une EA existe déjà merci de la périmer si necessaire .¶MAIRIE 23/06/2020:   Construction en cours,2023,,6,,,1,661807.91780,6867621.26598,2154,MAN,0H0384,108,,,6,O,,,N,,,,,,,,
93010,930100001137158,O,5,,BAT 300-400,R,NADIA MURAD,6600,HABIT,23,46,4,PC9301018B0025,MAIRIE 26/10/2023: 5 rue nadia murad = bat 300 400 = 46¶7 rue nadia murad = bat 200 = 26¶7 rue simone veil = bat 100 = 25¶5 rue simone veil = bat 600 = 26 ¶2 rue gisèle halimi = bat 500 = 15        ¶INSEE 06/10/2023: Adresse dont il faut revoir le dégroupement (nombre de logements par adresse + adressage complet des bâtiments).¶Pour rappel, vous indiquiez 'MAIRIE 17/07/2023: dégroupement 7 rue nadia murad, bat 100 (12 BAL) et bat 200 (au 7 toujours) (14 BAL) - bat 300 et 400 (46 BAL) au 2 gisèle Halimi, bat 500 (15 BAL) au 2 g. halimi également, au 5 simone veil bat 600 (26 bal).' ¶¶INSEE 26/04/2023: Îlot C8 : ¶1-3-5-7 rue Simone Veil + 5-7 rue Nadia Murad + 2-4 rue Gisèle Halimi + 1-3 quai Hubertine Auclert. ¶Merci de nous communiquer le dégroupement lorsqu'il sera connu (adresse + bâtiment + nombre de logements).¶MAIRIE 11/04/2023: à revoir dans 6 mois¶MAIRIE 09/12/2022: Idem¶MAIRIE 19/05/2022: idem¶INSEE 23/09/2021: LOT C08 ZAC DES RIVES DE L'OURCQ¶MAIRIE 03/03/2021:  Immeubles en cours de construction¶INSEE 05/09/2019: Création EA suite 1er flux de pc je l'ai plaçe a la ref cadastrale une EA existe déjà merci de la périmer si necessaire .¶MAIRIE 23/06/2020:   Construction en cours,2023,,6,,,1,661776.45562,6867650.48828,2154,MAN,0H0384,108,,,6,O,,,N,,,,,,,,
93010,930100001137159,O,7,,BAT 200,R,NADIA MURAD,6600,HABIT,23,26,4,PC9301018B0025,MAIRIE 26/10/2023: 5 rue nadia murad = bat 300 400 = 46¶7 rue nadia murad = bat 200 = 26¶7 rue simone veil = bat 100 = 25¶5 rue simone veil = bat 600 = 26 ¶2 rue gisèle halimi = bat 500 = 15        ¶INSEE 06/10/2023: Adresse dont il faut revoir le dégroupement (nombre de logements par adresse + adressage complet des bâtiments).¶Pour rappel, vous indiquiez 'MAIRIE 17/07/2023: dégroupement 7 rue nadia murad, bat 100 (12 BAL) et bat 200 (au 7 toujours) (14 BAL) - bat 300 et 400 (46 BAL) au 2 gisèle Halimi, bat 500 (15 BAL) au 2 g. halimi également, au 5 simone veil bat 600 (26 bal).' ¶¶INSEE 26/04/2023: Îlot C8 : ¶1-3-5-7 rue Simone Veil + 5-7 rue Nadia Murad + 2-4 rue Gisèle Halimi + 1-3 quai Hubertine Auclert. ¶Merci de nous communiquer le dégroupement lorsqu'il sera connu (adresse + bâtiment + nombre de logements).¶MAIRIE 11/04/2023: à revoir dans 6 mois¶MAIRIE 09/12/2022: Idem¶MAIRIE 19/05/2022: idem¶INSEE 23/09/2021: LOT C08 ZAC DES RIVES DE L'OURCQ¶MAIRIE 03/03/2021:  Immeubles en cours de construction¶INSEE 05/09/2019: Création EA suite 1er flux de pc je l'ai plaçe a la ref cadastrale une EA existe déjà merci de la périmer si necessaire .¶MAIRIE 23/06/2020:   Construction en cours,2023,,6,,,1,661741.84254,6867649.14861,2154,MAN,0H0396,108,,,6,O,,,N,,,,,,,,
93010,930100001137160,O,7,,BAT 100,R,SIMONE VEIL,8529,HABIT,23,25,4,PC9301018B0025,MAIRIE 26/10/2023: 5 rue nadia murad = bat 300 400 = 46¶7 rue nadia murad = bat 200 = 26¶7 rue simone veil = bat 100 = 25¶5 rue simone veil = bat 600 = 26 ¶2 rue gisèle halimi = bat 500 = 15        ¶INSEE 06/10/2023: Adresse dont il faut revoir le dégroupement (nombre de logements par adresse + adressage complet des bâtiments).¶Pour rappel, vous indiquiez 'MAIRIE 17/07/2023: dégroupement 7 rue nadia murad, bat 100 (12 BAL) et bat 200 (au 7 toujours) (14 BAL) - bat 300 et 400 (46 BAL) au 2 gisèle Halimi, bat 500 (15 BAL) au 2 g. halimi également, au 5 simone veil bat 600 (26 bal).' ¶¶INSEE 26/04/2023: Îlot C8 : ¶1-3-5-7 rue Simone Veil + 5-7 rue Nadia Murad + 2-4 rue Gisèle Halimi + 1-3 quai Hubertine Auclert. ¶Merci de nous communiquer le dégroupement lorsqu'il sera connu (adresse + bâtiment + nombre de logements).¶MAIRIE 11/04/2023: à revoir dans 6 mois¶MAIRIE 09/12/2022: Idem¶MAIRIE 19/05/2022: idem¶INSEE 23/09/2021: LOT C08 ZAC DES RIVES DE L'OURCQ¶MAIRIE 03/03/2021:  Immeubles en cours de construction¶INSEE 05/09/2019: Création EA suite 1er flux de pc je l'ai plaçe a la ref cadastrale une EA existe déjà merci de la périmer si necessaire .¶MAIRIE 23/06/2020:   Construction en cours,2023,,6,,,1,661725.80205,6867631.80670,2154,MAN,0H0396,108,,,6,O,,,N,,,,,,,,
93010,930100001137161,O,5,,BAT 600,R,SIMONE VEIL,8529,HABIT,23,26,4,PC9301018B0025,MAIRIE 26/10/2023: 5 rue nadia murad = bat 300 400 = 46¶7 rue nadia murad = bat 200 = 26¶7 rue simone veil = bat 100 = 25¶5 rue simone veil = bat 600 = 26 ¶2 rue gisèle halimi = bat 500 = 15        ¶INSEE 06/10/2023: Adresse dont il faut revoir le dégroupement (nombre de logements par adresse + adressage complet des bâtiments).¶Pour rappel, vous indiquiez 'MAIRIE 17/07/2023: dégroupement 7 rue nadia murad, bat 100 (12 BAL) et bat 200 (au 7 toujours) (14 BAL) - bat 300 et 400 (46 BAL) au 2 gisèle Halimi, bat 500 (15 BAL) au 2 g. halimi également, au 5 simone veil bat 600 (26 bal).' ¶¶INSEE 26/04/2023: Îlot C8 : ¶1-3-5-7 rue Simone Veil + 5-7 rue Nadia Murad + 2-4 rue Gisèle Halimi + 1-3 quai Hubertine Auclert. ¶Merci de nous communiquer le dégroupement lorsqu'il sera connu (adresse + bâtiment + nombre de logements).¶MAIRIE 11/04/2023: à revoir dans 6 mois¶MAIRIE 09/12/2022: Idem¶MAIRIE 19/05/2022: idem¶INSEE 23/09/2021: LOT C08 ZAC DES RIVES DE L'OURCQ¶MAIRIE 03/03/2021:  Immeubles en cours de construction¶INSEE 05/09/2019: Création EA suite 1er flux de pc je l'ai plaçe a la ref cadastrale une EA existe déjà merci de la périmer si necessaire .¶MAIRIE 23/06/2020:   Construction en cours,2023,,6,,,1,661733.87550,6867603.91489,2154,MAN,0H0384,108,,,6,O,,,N,,,,,,,,
93010,930100001102120,O,11,,HALL B-C-D,R,SIMONE VEIL,8529,HABIT,23,40,3,PC9301018B0044,INSEE 25/04/2023: Le nombre de logements est donné pour l'ensemble du Carré des Rives qui comporte 2 EA (9 et 11 rue Simone Veil). Merci de répartir les 66 logements sur ces 2 EA quand la répartition sera connue (par défaut, nous avons mis 66 logements au 11 rue Simone Veil, et 0 logement au 9 rue Simone Veil).¶INSEE 25/04/2023: Suite à l'arrêté de numérotation n°A2022_406 du 12 août 2022, la numérotation du Carré des Rives (îlot C11A) sera la suivante : ¶- Hall A : 9 rue Simone Veil | ¶- Hall B : 11 rue Simone Veil | ¶- Local : 13 Chemin Latéral.¶MAIRIE 11/04/2023: en voie de finition¶MAIRIE 09/12/2022: Carré des rives toujours en travaux¶MAIRIE 19/05/2022: idem¶MAIRIE 03/03/2021 constructions en cours ¶INSEE 05/09/2019: Création nouvelle EA suite 1 er flux de PC 2019/2020.merci de verifier le placement des PC du chemin latéral et le nombres de logements voir dégroupement quant actu 0¶MAIRIE 23/06/2020:  construction en cours,0,,5,,,1,661723.73218,6867698.96097,2154,MAN,0H0397,108,,,6,O,,,N,,20231030,,,,,,,
93010,930100001102119,O,9,,HALL A,R,SIMONE VEIL,8529,HABIT,23,26,3,PC9301018B0044,INSEE 25/04/2023: Le nombre de logements est donné pour l'ensemble du Carré des Rives qui comporte 2 EA (9 et 11 rue Simone Veil). Merci de répartir les 66 logements sur ces 2 EA quand la répartition sera connue (par défaut, nous avons mis 66 logements au 11 rue Simone Veil, et 0 logement au 9 rue Simone Veil).¶INSEE 25/04/2023: Suite à l'arrêté de numérotation n°A2022_406 du 12 août 2022, la numérotation du Carré des Rives (îlot C11A) sera la suivante : ¶- Hall A : 9 rue Simone Veil | ¶- Hall B : 11 rue Simone Veil | ¶- Local : 13 Chemin Latéral.¶MAIRIE 11/04/2023: en voie de finition¶MAIRIE 09/12/2022: Carré des rives toujours en travaux¶MAIRIE 19/05/2022: idem¶MAIRIE 03/03/2021 constructions en cours ¶INSEE 05/09/2019: Création nouvelle EA suite 1 er flux de PC 2019/2020.merci de verifier le placement des PC du chemin latéral et le nombres de logements voir dégroupement quant actu 0¶MAIRIE 23/06/2020:  construction en cours,0,,5,,,1,661724.55186,6867674.25414,2154,MAN,0H0397,108,,,6,O,,,N,,20231030,,,,,,,
93010,930100001079925,O,20,,,R,BOREL,750,HABIT,23,85,2,PC9301022B0016,MAIRIE 31/10/2023: travaux non commencés, donc pas de péremption de l'EA¶MAIRIE 12/04/2023: travaux non commencés¶INSEE 09/12/2022: Une EA existe déjà à cette adresse, et plusieurs EA existent déjà sur les parcelles cadastrales concernées. Il y a un PD rattaché à ce PC (PD9301021B0008) qui indique 9 habitations à démolir.¶Faut-il périmer l'ancienne EA du 20 rue Borel et conserver la nouvelle ? Merci de faire les modifications nécessaires.,0,,5,,,1,662358.00000,6867673.10000,2154,BDA1,L0094,106,,,6,O,,,N,,,,,,,,,,
93010,930100001079916,O,1,,,ALL,DES HETRES,4450,HABIT,23,15,3,PC9301021B0078,MAIRIE 31/10/2023: aucun travaux¶MAIRIE 04/04/2023: travaux non commencés¶INSEE 09/12/2022: Une EA existe déjà à cette adresse. Le PC indique 'construction nouvelle : construction d'un immeuble de 15 logements sur 5 étages'. Faut-il périmer l'ancienne EA et conserver la nouvelle ? Merci de faire les modifications nécessaires.,0,,5,,,1,661889.10000,6866060.80000,2154,BDA1,AV0140,301,,,6,O,,,N,,,,,,,,,,,,
93010,930100001079828,O,19,,PC9301021B0034,CHE,DE LA MARE A LA VEUVE,6150,HABIT,21,1,3,PC9301021B0034,MAIRIE 31/10/2023: vu le propriétaire. le pc porte une maison mais il en a construit 3. pb finalisation chantier car viabilisation coûteuse. Les adresses sont bien 19 - 21 - 23.¶MAIRIE 04/04/2023: travaux en cours d'achèvement (6 mois)¶INSEE 08/12/2022: Merci de vérifier l'actualité et le positionnement de l'entité adressée.,0,,0,,,1,661727.56743,6865617.51143,2154,MAN,BF0002,301,,,6,O,,,N,,,,,,,,,,,,
